{
  "id": "sample-reform",
  "source": { "platform": "crowdworks", "url": "", "title": "リフォーム会社の顧客・案件管理システム（スプレッドシート脱却）" },
  "client": {
    "brand": "（御社名）リフォーム",
    "industry": "水まわり・内装リフォーム業",
    "area": "静岡県西部",
    "services": ["キッチン・浴室・トイレの交換", "内装（クロス・床）リフォーム", "給湯器・水栓の修理", "外構・小工事"],
    "terms": ["現調（現地調査）", "見積提出", "着工", "完了", "追いかけ", "職人配置"]
  },
  "pain": [
    "誰がどの案件を担当しているか分からなくなる",
    "お客様への折り返し電話を忘れる（架電履歴が残らない）",
    "見積提出後の追いかけができておらず失注している",
    "現場（職人）の配置が口頭で決まり、ダブルブッキングが起きる"
  ],
  "screen": {
    "template": "crm",
    "must_have": ["案件一覧（ステータス管理）", "顧客情報と架電・対応履歴", "営業・職人の配置が分かる画面", "スマホからの入力"],
    "nice_to_have": ["LINE 通知"]
  },
  "target": "営業2名・職人3名・事務1名の社内スタッフ（現場からはスマホで入力）",
  "budget": { "min": 300000, "max": 600000, "note": "内容により相談可" },
  "deadline": "12月中旬までに使い始めたい",
  "tone": "信頼感・シンプルで見やすい",
  "palette": { "primary": "#1e3a8a", "accent": "#f59e0b" },
  "facts": [
    "従業員6名（営業2名・職人3名・事務1名）",
    "現在は Google スプレッドシートと LINE で管理",
    "予算 30〜60万円、納期 12月中旬",
    "ステータスは 新規 / 現調予定 / 見積提出 / 受注 / 着工 / 完了 / 失注"
  ],
  "assumptions": [
    "ログインは管理者とスタッフの2種類で足りる",
    "既存のスプレッドシートから案件・顧客を移行する",
    "LINE 通知は公式アカウント（Messaging API）で、担当者と顧客の両方に送る"
  ],
  "demo_data": {
    "statuses": ["新規", "現調予定", "見積提出", "受注", "着工", "完了", "失注"],
    "staff": ["営業 佐藤", "営業 鈴木", "職人 高橋", "職人 田村", "職人 中島"],
    "records": [
      { "name": "田中 様（浴室交換）", "status": "現調予定", "staff": "営業 佐藤", "date": "2026-10-20", "next": "10:00", "amount": 980000, "memo": "ユニットバス交換。10/23 現調。在来工法のため解体費を要確認", "phone_masked": "090-****-1123" },
      { "name": "山本 様（キッチン）", "status": "見積提出", "staff": "営業 鈴木", "date": "2026-10-18", "next": "", "amount": 1450000, "memo": "10/18 見積送付。食洗機追加の要望あり。追いかけ未実施", "phone_masked": "080-****-4471" },
      { "name": "中村 様（トイレ）", "status": "受注", "staff": "営業 佐藤", "date": "2026-10-15", "next": "13:00", "amount": 280000, "memo": "11/2 着工予定。便器の納期を確認中", "phone_masked": "090-****-8820" },
      { "name": "小林 様（クロス張替）", "status": "着工", "staff": "職人 高橋", "date": "2026-10-10", "next": "", "amount": 320000, "memo": "LDK と廊下。10/21〜23 の3日間", "phone_masked": "070-****-3390" },
      { "name": "加藤 様（給湯器）", "status": "完了", "staff": "職人 田村", "date": "2026-10-08", "next": "", "amount": 210000, "memo": "10/12 交換完了。請求書送付済み", "phone_masked": "090-****-2217" },
      { "name": "吉田 様（洗面台）", "status": "新規", "staff": "営業 鈴木", "date": "2026-10-21", "next": "15:00", "amount": 0, "memo": "HP から問い合わせ。折り返し待ち", "phone_masked": "080-****-6604" },
      { "name": "山田 様（外構・フェンス）", "status": "見積提出", "staff": "営業 佐藤", "date": "2026-10-12", "next": "", "amount": 560000, "memo": "10/12 見積送付。10/19 に一度不在。再架電が必要", "phone_masked": "090-****-7718" },
      { "name": "松本 様（床の張替）", "status": "受注", "staff": "職人 中島", "date": "2026-10-14", "next": "", "amount": 410000, "memo": "11/5 着工。フローリング材 手配済み", "phone_masked": "070-****-5522" },
      { "name": "井上 様（浴室乾燥機）", "status": "失注", "staff": "営業 鈴木", "date": "2026-10-05", "next": "", "amount": 150000, "memo": "他社に決定。価格差 2万円", "phone_masked": "090-****-9041" },
      { "name": "木村 様（キッチン水栓）", "status": "完了", "staff": "職人 田村", "date": "2026-10-16", "next": "", "amount": 48000, "memo": "即日対応。保証書を渡し済み", "phone_masked": "080-****-1308" },
      { "name": "林 様（和室→洋室）", "status": "現調予定", "staff": "営業 鈴木", "date": "2026-10-19", "next": "16:30", "amount": 850000, "memo": "10/24 現調。畳下地の状態を確認", "phone_masked": "090-****-6675" },
      { "name": "斎藤 様（トイレ・手洗い）", "status": "新規", "staff": "営業 佐藤", "date": "2026-10-21", "next": "", "amount": 0, "memo": "紹介案件。来週連絡希望", "phone_masked": "070-****-2284" }
    ]
  }
}
